<?xml version="1.0" encoding="UTF-8"?>
<Definitions xmlns:xsi="http://www.w3.org/2001/XMLSchema-instance" xsi:noNamespaceSchemaLocation="../../../../definition.xsd">
  <Configuration>
    <Parameter>
      <Name>Name</Name>
      <Type>Integer</Type>
      <Value>Value</Value>
    </Parameter>
  </Configuration>
  <PlayerChoiceVariables>
    <PlayerChoiceVariable>
      <Name>Name</Name>
      <Type>Integer</Type>
    </PlayerChoiceVariable>
  </PlayerChoiceVariables>
  <UserStateVariables>
    <UserStateVariable>
      <Name>Name</Name>
      <Type>Integer</Type>
    </UserStateVariable>
  </UserStateVariables>
  <WorldStateVariables>
    <WorldStateVariable>
      <Name>Name</Name>
      <Type>Integer</Type>
    </WorldStateVariable>
  </WorldStateVariables>
  <ExternalVariables>
    <PlayerChoiceVariable>
      <Name>Name</Name>
      <Type>Integer</Type>
      <uriLocation>http://tempuri.org</uriLocation>
    </PlayerChoiceVariable>
  </ExternalVariables>
  <RandomNumberGenerators>
    <RandomNumberGenerator>
      <Name>Name</Name>
      <Expression>Expression</Expression>
    </RandomNumberGenerator>
  </RandomNumberGenerators>
  <ChoicesToStateAlgorithm>ChoicesToStateAlgorithm</ChoicesToStateAlgorithm>
</Definitions>
